{
    "$schema": "http://json-schema.org/draft-07/schema#",
    "type": "object",
    "required": ["id", "name", "instructions", "ingredients"],
    "properties": {
        "id": {
            "type": "string",
            "pattern": "^[a-z][a-zA-Z0-9]*$",
            "description": "Unique identifier matching the base cocktail (in camelCase)"
        },
        "name": {
            "type": "string",
            "description": "Translated name of the cocktail"
        },
        "instructions": {
            "type": "string",
            "description": "Translated step-by-step instructions"
        },
        "ingredients": {
            "type": "object",
            "patternProperties": {
                "^[a-z][a-zA-Z0-9]*$": {
                    "type": "string",
                    "description": "Translated ingredient name"
                }
            },
            "description": "Translations for ingredient names, keyed by ingredient id (in camelCase)"
        }
    }
}
