{
    "id": "moscowMule",
    "name": "Moscow Mule",
    "instructions": "1. Fill a copper mug with ice\n2. Add vodka and lime juice\n3. Top with ginger beer\n4. Stir gently to combine\n5. Garnish with a lime wheel and optional mint sprig",
    "ingredients": {
        "vodka": "Vodka",
        "limeJuice": "Fresh Lime Juice",
        "gingerBeer": "Ginger Beer"
    }
}
